{
  "schema": "shapeforge.render-capture/1.0",
  "id": "hero/capture-1",
  "candidateId": "hero/revision-1",
  "width": 512,
  "height": 512,
  "views": [
    { "id": "front", "azimuth": 0, "elevation": 0, "framingScale": 1.1 },
    { "id": "side", "azimuth": 90, "elevation": 0, "framingScale": 1.1 },
    { "id": "back", "azimuth": 180, "elevation": 0, "framingScale": 1.1 }
  ]
}
